### ISSUE TITLE
Haraka Crashing when specific mail server tries to send me mail

### ISSUE THREAD

**Issue by Infern1** [baudehlo/Haraka#941]
Since two days I have the problem Haraka crashes when some mailserver is trying to send me a mail.

See this gist for the LOG https://gist.github.com/Infern1/0196437e4fd65c6182f1

Please advice how debug further

PCAP https://admin.bsdfreaks.nl/capture_data.pcap

**Comment by smfreegard** [comment]
Rob,

SIGSEGV is an unusual thing to be getting.  Have you recently upgraded Node and forgotten to re-compile your native modules against the new version??

Depending where your module install path is - likely /usr/local/lib/node_modules/Haraka or /usr/lib/node_modules/Haraka, change to the directory and run 'npm install' and it will rebuild the dependent modules.  That might fix this error, give it a try and let me know.

**Comment by Infern1** [comment]
Did it:

# cd /usr/local/lib/node_modules/Haraka && npm install                                                                                                
/usr/local/lib/node_modules/Haraka # npm install express                                                                                                                                 
express@4.12.3 node_modules/express
├── merge-descriptors@1.0.0
├── utils-merge@1.0.0
├── cookie-signature@1.0.6
├── methods@1.1.1
├── fresh@0.2.4
├── cookie@0.1.2
├── escape-html@1.0.1
├── range-parser@1.0.2
├── content-type@1.0.1
├── finalhandler@0.3.4
├── vary@1.0.0
├── parseurl@1.3.0
├── serve-static@1.9.2
├── content-disposition@0.5.0
├── path-to-regexp@0.1.3
├── depd@1.0.0
├── qs@2.4.1
├── on-finished@2.2.0 (ee-first@1.1.0)
├── proxy-addr@1.0.7 (forwarded@0.1.0)
├── debug@2.1.3 (ms@0.7.0)
├── etag@1.5.1 (crc@3.2.1)
├── send@0.12.2 (destroy@1.0.3, ms@0.7.0, mime@1.3.4)
├── accepts@1.2.5 (negotiator@0.5.1, mime-types@2.0.10)
└── type-is@1.6.1 (media-typer@0.3.0, mime-types@2.0.10)

Have to wait now

**Comment by Infern1** [comment]
Problem still exists

**Comment by smfreegard** [comment]
Ok - how did you install Node? and which version and what OS?

**Comment by msimerson** [comment]
Hey Rob, provide us with a little more info and history.

* Platform: Iron or Virtual?  Hypervisor?
* OS: (uname -a)
* Node: 0.10 or 0.12?  (node --version)
* Any recent changes?
* Any other apps experiencing similar errors?

I'm guessing FreeBSD 10.1 with node 0.10.3?. The default node is now 0.12, so if you did a `pkg upgrade` recently, you might have ended up with 0.12.

When I encounter SIGSEGV errors on FreeBSD, the very first thing I think about is a RAM stick failing. In my admittedly small sample size (hundreds of servers), the replacement of hardware has, more often than not, "fixed" the problem.

**Comment by msimerson** [comment]
### converted PCAP

````
05:23:07.664772 IP mx1.leijgraaf.nl.36044 > vps1.bsdfreaks.nl.smtp: Flags [S], seq 1631957527, win 14600, options [mss 1380,sackOK,TS val 3929318349 ecr 0,nop,wscale 7], length 0
05:23:07.668548 IP mx1.leijgraaf.nl.36044 > vps1.bsdfreaks.nl.smtp: Flags [.], ack 1751113236, win 115, options [nop,nop,TS val 3929318352 ecr 1904968803], length 0
05:23:08.229978 IP mx1.leijgraaf.nl.36044 > vps1.bsdfreaks.nl.smtp: Flags [.], ack 57, win 115, options [nop,nop,TS val 3929318914 ecr 1904969363], length 0
05:23:08.230080 IP mx1.leijgraaf.nl.36044 > vps1.bsdfreaks.nl.smtp: Flags [P.], seq 0:28, ack 57, win 115, options [nop,nop,TS val 3929318914 ecr 1904969363], length 28
05:23:08.938149 IP mx1.leijgraaf.nl.36044 > vps1.bsdfreaks.nl.smtp: Flags [F.], seq 28, ack 58, win 115, options [nop,nop,TS val 3929319621 ecr 1904970070], length 0
````

**Comment by msimerson** [comment]
### Another question:

* What log messages typically follow this line in your logs:
````
[access] pass:unlisted(conn), connect:any, helo:any
````

Wild guess: dnsbl.

**Comment by Infern1** [comment]
Virtual server
#OS: (uname -a)
10.1-RELEASE-p9 FreeBSD 10.1-RELEASE-p9

#Node: 0.10 or 0.12? (node --version)
v0.10.38

#Any recent changes?
not that I know

#Any other apps experiencing similar errors?
nope

#I'm guessing FreeBSD 10.1 with node 0.10.3?. The default node is now 0.12, so if you did a pkg upgrade recently, you might have ended up with 0.12.

node010-0.10.38

I did recompile npm with your new options (https://www.tnpi.net/wiki/MT6_SMTP) (Just today because of the problems)

Did a npm rebuild afterwards

#When I encounter SIGSEGV errors on FreeBSD, the very first thing I think about is a RAM stick failing.
No devices attached

'Apr 25 00:09:32 smtp haraka[44088]: [INFO] [85B6CED6-9EF6-4BA4-B84E-18E6E8390AEA] [access] pass:unlisted(conn), connect:any
Apr 25 00:09:32 smtp haraka[44088]: [INFO] [85B6CED6-9EF6-4BA4-B84E-18E6E8390AEA] [connect.geoip] asn: 20857, org: TransIP B.V.
Apr 25 00:09:32 smtp haraka[44088]: [INFO] [85B6CED6-9EF6-4BA4-B84E-18E6E8390AEA] [connect.geoip] EU, NL, 0km
Apr 25 00:09:32 smtp haraka[89756]: [INFO] [368F67C4-7791-4B13-88C6-8C7D78F2D728] [karma] tarpit quit end
A'

**Comment by Infern1** [comment]
The recompile of node and npm did solve the problem as it looks like

https://gist.github.com/Infern1/663b2068bd3f866c13e9

No more crashes from when this ip is connecting

**Comment by msimerson** [comment]
Interesting. The plugin that was running when the SIGSEGV occurred is the SPF plugin. Interesting.
